{
  "schema_version": "1.0",
  "data_status": "sample",
  "generated_at": "2026-01-15T12:00:00Z",
  "provider": "fixture",
  "assets": [
    {"id": "sp500", "name": "S&P 500", "symbol": "^GSPC", "current_value": 6000.12, "change": 25.2, "change_percent": 0.42, "updated_at": "2026-01-15T12:00:00Z", "data_status": "sample"},
    {"id": "nasdaq_composite", "name": "NASDAQ Composite", "symbol": "^IXIC", "current_value": 19620.45, "change": -42.1, "change_percent": -0.21, "updated_at": "2026-01-15T12:00:00Z", "data_status": "sample"},
    {"id": "dow_jones", "name": "Dow Jones", "symbol": "^DJI", "current_value": 43950.21, "change": 0, "change_percent": 0, "updated_at": "2026-01-15T12:00:00Z", "data_status": "sample"},
    {"id": "gold", "name": "Gold", "symbol": "GC=F", "current_value": 2684.3, "change": -6.5, "change_percent": -0.24, "updated_at": "2026-01-15T12:00:00Z", "data_status": "sample"},
    {"id": "wti", "name": "WTI Crude Oil", "symbol": "CL=F", "current_value": 76.42, "change": 0.27, "change_percent": 0.35, "updated_at": "2026-01-15T12:00:00Z", "data_status": "sample"},
    {"id": "bitcoin", "name": "Bitcoin", "symbol": "BTC-USD", "current_value": 98240, "change": 1242.5, "change_percent": 1.28, "updated_at": "2026-01-15T12:00:00Z", "data_status": "sample"},
    {"id": "us10y", "name": "US 10Y Treasury Yield", "symbol": "^TNX", "current_value": 4.36, "change": -0.01, "change_percent": -0.23, "updated_at": "2026-01-15T12:00:00Z", "data_status": "sample"}
  ]
}
