{
  "schema_version": "1.0",
  "data_status": "live",
  "generated_at": "2026-09-24T23:56:31.941609Z",
  "provider": "yahoo_finance",
  "assets": [
    {
      "id": "sp500",
      "name": "S&P 500",
      "symbol": "^GSPC",
      "current_value": 7704.13,
      "change": -1.8999999999996362,
      "change_percent": -0.025,
      "updated_at": "2026-09-24T20:36:52Z",
      "data_status": "live"
    },
    {
      "id": "nasdaq_composite",
      "name": "NASDAQ Composite",
      "symbol": "^IXIC",
      "current_value": 26939.373,
      "change": 3.3329999999987194,
      "change_percent": 0.012,
      "updated_at": "2026-09-24T21:15:59Z",
      "data_status": "live"
    },
    {
      "id": "dow_jones",
      "name": "Dow Jones",
      "symbol": "^DJI",
      "current_value": 51349.98,
      "change": -161.6099999999933,
      "change_percent": -0.314,
      "updated_at": "2026-09-24T20:37:04Z",
      "data_status": "live"
    },
    {
      "id": "gold",
      "name": "Gold",
      "symbol": "GC=F",
      "current_value": 4308.7,
      "change": -9.699999999999818,
      "change_percent": 0.249,
      "updated_at": "2026-09-24T23:46:24Z",
      "data_status": "live"
    },
    {
      "id": "wti",
      "name": "WTI Crude Oil",
      "symbol": "CL=F",
      "current_value": 93.96,
      "change": 1.7999999999999972,
      "change_percent": -0.687,
      "updated_at": "2026-09-24T23:46:21Z",
      "data_status": "live"
    },
    {
      "id": "bitcoin",
      "name": "Bitcoin",
      "symbol": "BTC-USD",
      "current_value": 84376.9,
      "change": -6.110000000000582,
      "change_percent": -0.002,
      "updated_at": "2026-09-24T23:56:26Z",
      "data_status": "live"
    },
    {
      "id": "us10y",
      "name": "US 10Y Treasury Yield",
      "symbol": "^TNX",
      "current_value": 5.162,
      "change": 0.04800000000000004,
      "change_percent": 0.939,
      "updated_at": "2026-09-24T18:59:54Z",
      "data_status": "live"
    }
  ]
}
